id,question,choice1,choice2,choice3,choice4,explanation,img,category
7-844,床上排泄の介助について適切なのはどれか,腰があげられない場合は便器を側臥位で当てながら仰臥位に戻す,男性の排便の際に尿器の準備は不要である,女性が尿器で排尿する際は尿道口に尿器を当てる,肛門が便器の受け口の上部に位置するよう便器を挿入する,正解：腰があげられない場合は便器を側臥位で当てながら仰臥位に戻す\n男性の場合は排便の際に尿器も用意します。女性が尿器で排尿する際は尿器の受け口を会陰に密着させ、患者の体位を配慮します。肛門が受け口の中央となるように配置します。実力テスト⑥にあります。,img/1345.png,基礎
7-845,次のうち正しいのはどれか,解除を必要とする患者の歯磨きではブラッシング前に口腔内を観察する,義歯は上顎から下顎の順に外す,歯ブラシを直角に当てて細かく左右に動かす方法をバス法という,歯面に対し45度に歯ブラシを当て小刻みに動かす方法をフォーンズ法という,正解：解除を必要とする患者の歯磨きではブラッシング前に口腔内を観察する\n義歯は下顎から外します。バス法は歯ブラシの毛先を歯と歯ブラシの境目に45度の角度で当て歯周ポケットの中に毛先を入れて小刻みに動かす方法です。フォーンズ法は円を描くように磨くシンプルな歯磨き方法です。歯ブラシを直角に当てて細かく左右に動かす方法はスクラビング法です。実力テスト⑥にあります。,img/1346.png,基礎
7-846,清拭の援助で適切なのはどれか,腹部は臍を中心に腸の走行に沿って拭く,食後1時間以内に行う,室温は18～20度に調節する,石けん分は湯で絞ったタオルで1回ふき取る,正解：腹部は臍を中心に腸の走行に沿って拭く\n食後1時間以内の清拭は内臓の血液量が減るため避けます。室温は22～26度に調整します。石けん分は残さずにふき取ります。実力テスト⑥にあります。,img/1347.png,基礎
7-847,不眠を訴える患者の看護について適切なのはどれか,就寝前に足浴を行い入眠を促す,原因にかかわらず睡眠薬の使用を促す,正午から就寝までは光刺激を与える,身体活動は避けてできるだけ安静を保つ,正解：就寝前に足浴を行い入眠を促す\n睡眠薬は医師と検討しつつ身長に使います。就寝時に光刺激は避けます。適度な運動は睡眠を促します。実力テスト⑥にあります。,img/1348.png,基礎
7-848,褥瘡について誤っているのはどれか,側臥位は45度が望ましい,側臥位での褥瘡好発部位の1つに大転子部がある,低栄養状態の患者に褥瘡が発生しやすい,ブレーデンスケールの合計点が低いほど褥瘡のリスクが高い,正解：側臥位は45度が望ましい\n側臥位は30度が望ましいです。実力テスト⑥にあります。,img/1349.png,基礎
7-849,静脈血採血について正しいのはどれか,採血部位は一般的に肘正中皮静脈を用いる,注射針は25～27Gを使用する,針の刺入角度は30～45度で行う,採決後抗凝固剤の入った採血管を強めよく振る,正解：採血部位は一般的に肘正中皮静脈を用いる\n静脈血の注射針は21～23G角度は10～20度で穿刺します。抗凝固剤の入った採血管を強く振ると赤血球が壊れる可能性があります。実力テスト⑥にあります。,img/1350.png,基礎
7-850,各与薬法について適切でないのはどれか,バッカル錠はよくかんで内服する,点耳薬は人肌程度に温めて使用する,点鼻薬を使用するときは容器が鼻孔に触れないように注意する,経皮吸入パッチは皮膚尾w清潔にしてから貼布する,正解：バッカル錠はよくかんで内服する\nバッカル錠は噛みません。実力テスト⑥にあります。,img/1351.png,基礎
7-851,中心静脈栄養法について正しいのはどれか,主な合併症に気胸がある,主に上大静脈や下大静脈から刺入する,カテーテルの先端は右心房内に留置する,高カロリーの栄養剤は点滴できない,正解：主な合併症に気胸がある\nTPNは内経静脈、鎖骨下静脈、尺側皮静脈、大腿静脈から穿刺します。カテーテルは右心房に入らないように血管内に留置します。高カロリー輸液の点滴に用います。実力テスト⑥にあります。,img/1352.png,基礎
7-852,罨法の目的・種類・禁忌で正しいのはどれか,湯たんぽは乾性の温罨法である,氷枕は湿性の冷罨法である,冷罨法は排ガスを促進させる,温罨法は循環不順には禁忌である,正解：湯たんぽは乾性の温罨法である\n氷枕は乾性の冷罨法です。排ガスを促す場合は温罨法が効果的です。循環不順の患者には冷罨法が禁忌となります。実力テスト⑥にあります。,img/1353.png,基礎
7-853,導尿について適切なのはどれか,女性の場合、挿入するカテーテルの長さは4～6ｃｍである,カテーテル挿入時に無菌操作は必要ない,カテーテル挿入時は息を止めるよう説明する,持続的導尿の畜尿バッグは膀胱より高くなるように固定する,正解：女性の場合、挿入するカテーテルの長さは4～6ｃｍである\nカテーテル挿入は無菌操作で行います。挿入時は口呼吸を促します。持続的導尿時は畜尿バックが膀胱より低い位置にあるようにします。実力テスト⑥にあります。,img/1354.png,基礎
7-854,胃洗浄について適切なのはどれか,患者の体位は左側臥位にする,成人の場合20frの胃管を用いる,40～45度の洗浄液を準備する,注入する洗浄液の一回量は1L以上である,正解：患者の体位は左側臥位にする\n成人の胃洗浄に用いる胃管の太さは34～36frを用います。洗浄液は37～38度とします。注入の一回量は200～300mlです。実力テスト⑥にあります。,img/1355.png,基礎
7-855,穿刺部位の目安となる組み合わせで正しいのはどれか,腹腔穿刺ーーーモンローリヒター線,腰椎穿刺ーーーマックバーネー点,胸腔穿刺ーーーヤコビー線,骨髄穿刺ーーークラークの点,正解：腹腔穿刺ーーーモンローリヒター線\n腰椎穿刺にはヤコビー線を用います。マックバーネの点は急性虫垂炎の診断においての圧痛点です。クラークの点は筋肉注射に用いる三角筋にある部位です。胸腔穿刺は医師が部位を定めます。骨髄穿刺は腸骨や胸骨に行います。実力テスト⑥にあります。,img/1356.png,基礎
7-856,一時的吸引について適切なのはどれか,吸引圧は150ｍｍHg（20ｋPa）に調整する,カテーテル挿入時はカテーテルをまわしながら挿入する,1回の吸引は30秒かけて行う,鼻腔・口腔の吸引は無菌操作で行う,正解：吸引圧は150ｍｍHg（20ｋPa）に調整する\nカテーテル挿入時はカテーテルをまわしながら抜きます。1回の吸引は10秒以内にとどめます。鼻腔・口腔の吸引は清潔操作で行います。実力テスト⑥にあります。,img/1357.png,基礎
7-857,500Lの酸素ボンベ（充填圧14.7MPa）を使用して1っ分間に2.5Lの流量で酸素吸入をしている。圧力計が4MPaを示しているときの酸素使用可能時間はどれか,54分,44分,34分,14分,正解：54分\n5000：147＝ｘ：4にて147ｘ：20000となり計算すると135Ｌ残っていることがわかります。135/2.5にて54分となります。実力テスト⑥にあります。,img/1358.png,基礎
7-858,包帯法について正しいのはどれか,接転帯は下腿のように細い部分と太い部分がある場合に用いる,牽引は包帯法の目的に含まない,環行帯は肘関節や膝関節など伸展する部位に用いる,三角筋はネット包帯に分類される,正解：接転帯は下腿のように細い部位と太い部位がある場合に用いる\n牽引は包帯法の目的に含みます。環行帯は巻き始めと巻き終わりに用います。三角巾は布帕包帯です。実力テスト⑥にあります。,img/1359.png,基礎
7-859,情動焦点型コーピングで適切でないのはどれか,原因がどこにあるかを明確にする,嫌なことを考えないようにする,とりあえず好きなものを飲食する,つらい気持ちを人に話して苦痛を和らげる,正解：原因がどこにあるかを明確にする\n問題焦点型コーピングに当たります。実力テスト⑥にあります。,img/1360.png,基礎
7-860,マズローによる人間の基本的欲求について欲求のレベルが左から高い順に並んでいるのはどれか,自己実現、尊重、愛情と所属、安全、生理的欲求,安全、尊重、自己実現、愛情と所属、生理的欲求,自己実現、生理的欲求、安全、尊重、愛情と所属,安全、生理的欲求、尊重、自己実現、愛情と所属,正解：自己実現、尊重、愛情と所属、安全、生理的欲求\n実力テスト⑥にあります。,img/1361.png,基礎
7-861,キュプラーロスの死にゆく患者の心理プロセルはどれか,否認、怒り、取引、抑うつ、受容,受容、怒り、取引、抑うつ、否認,抑うつ、怒り、取引、否認、受容,否認、取引、怒り、受容、抑うつ,正解：否認、怒り、取引、抑うつ、受容/n実力テスト⑥にあります。,img/1362.png,基礎
7-862,国際生活機能分類について正しいのはどれか,背景因子には個人因子と環境因子がある,障害を重視する立場から1980年にWHOが発表した障害分類である,リハビリテーション分類である,生活機能を構成する要素に心身機能・身体構造、経済、休息があげられる,正解：背景因子に個人因子と環境因子がある\n国際生活機能分類は構成要素に生活機能障害として、心身機能と身体構造、活動、参加がありさらに背景因子として環境因子と個人因子があります。これらの構成要素はそれぞれが単独に存在するのではなく相互に影響を受け合う双方向の矢印で結ばれた相互作用もモデルとなることが改訂版の国際生活機能分類です。実力テスト⑥にあります。,img/1363.png,基礎
7-863,貧血のある患者の看護について適切なのはどれか,ゆっくりと動作するように促す,めまい時は頭部を高くする,進行の程度は自覚症状で判断する,末梢部の冷却に努める,正解：ゆっくりと動作するように促す\nめまい時は急に立ち上がらないように安静を保持します。字各症状がないこともあるため十分な観察をし随伴症状を確認します。末梢部は保温に努めます。実力テスト⑥にあります。,img/1364.png,基礎
7-864,ショックの5徴候にないものはどれか,顔面紅潮,虚脱,冷汗,脈拍蝕知不能,正解：顔面紅潮\nショックの5徴候は顔面蒼白、冷や汗、虚脱、脈拍蝕知不能、呼吸不全です。実力テスト⑥にあります。,img/1365.png,基礎
7-865,黄疸のある患者の看護で適切でないのはどれか,運動療法が有効であることを指導する,皮膚や粘膜を清潔に保つ,黄疸状態は自然光のもので観察する,黄疸の出現時は排泄物の色調を観察する,正解：運動療法が有効であることを指導する\n黄疸時は安静を促します。実力テスト⑥にあります。,img/1366.png,基礎
7-866,検査における看護について適切でないのはどれか,検査血管の説明は看護師が行う,検体の取り扱いはスタンダードプリコーションを守る,検体の取違に注意する,検査後は穿刺部位の圧迫固定は必要ない一般状態を観察する,正解：検査結果の説明は看護師が行う\n検査結果の説明は医師が行います。実力テスト⑥にあります。,img/1367.png,基礎
7-867,放射線療法の特徴について正しいのはどれか,身体的侵襲性が少ない,生殖腺は放射線感受性が低い,放射線宿酔は一度起こると治らない,照射後6か月以内に出現する急性有害反応がある,正解：身体的な侵襲性が少ない\n生殖腺は感受性が高いです。放射線宿酔は治療開始後2～3週間で軽快します。早期有害事象は治療中一か月後半くらいまでに起こるものをいいます。治療後3日k月以降から起こる有害反応を晩期有害事象といいます。実力テスト⑥にあります。,img/1368.png,基礎
7-868,ムーアによる術後患者の回復過程の第1層について正しいのはどれか,血糖の上昇,体温の正常化,四肢の筋力回復,体重の増加,正解：血糖値の上昇\n第移送は障害期であり尿量減少、血糖値上昇、体温上昇、腸蠕動停止などがみられます。第二相は転換期であり、食欲の改善、腸蠕動の再開、精神的ゆとりがみられます。第三層は筋力の回復であり筋力の回復体重の増加がみられます。第4層は脂肪蓄積期であり、脂肪組織の修復と増加によりずつ全のようなふっくらとした体格に戻ります。実力テスト⑥にあります。,img/1369.png,基礎
7-869,成人の胸骨圧迫について正しいのはどれか,圧迫の深さは約5ｃｍ沈むようにする,一分間あたり70～90回のテンポで圧迫する,胸骨圧迫と人工呼吸を行う場合は15；2の割合で行う,患者の胸の真ん中より左側の位置を圧迫する,正解：圧迫の深さは約5㎝沈むようにする\n胸骨の下半分を圧迫します。一分間あたり100～120回の圧迫をします。胸骨圧迫と人工呼吸の比は30：2です。実力テスト⑥にあります。,img/1370.png,基礎
8-1,核家族世帯に当たるものはどれか,夫婦のみ,独身者単独,夫婦と子供夫婦,夫婦とその親と夫婦の子供,正解：夫婦のみ\n独身者は準世帯となり、夫婦と子供夫婦・夫婦とその親と夫婦の子供は一般世帯となります。2025年2月准看テストにあります,img/1371.png,成人
8-2,生活習慣病の原因として適切でないものはどれか,交通事故,飲酒,喫煙,運動習慣,正解：交通事故\n2025年2月准看テストにあります。,img/1372.png,成人
8-3,肺の構造について正しいものはどれか,右肺3葉左肺2葉,右肺1葉左肺1葉,右肺2葉左肺3葉,,正解：右肺3葉左肺2葉\n2025年2月准看テストにあります。,img/1373.png,成人
8-4,スパイロメーターで測定できるのはどれか,肺活量,呼吸音,心拍出量,経皮的酸素飽和度,正解：肺活量\nスパイロメーターは肺の機能や呼吸能力を測定する医療機器です。2025年2月准看テストにあります。,img/1374.png,成人
8-5,肺結核症について正しいものはどれか,空気感染する,わが国では撲滅した感染症である,ワクチンは存在しない,患者と接する際はサージカルマスクを使用する,正解：空気感染する\n日本でも結核の患者はいます。ワクチンはあります。空気感染がおこるためn95マスクを着用します。2025年2月准看テストにあります。,img/1375.png,成人
8-6,自然気胸について正しいものはどれか,突然の喘鳴が特徴である,確定診断は胸部ｘ線検査である,治療は人工呼吸器による換気が行われる,,正解：突然の喘鳴が特徴である\n自然気胸は10～20代の男性に多いです。確定診断はレントゲンやＣＴで行います。治療は安静や胸腔ドレナージ、手術などがあります。2025年2月准看テストにあります。,img/1376.png,成人
8-7,ニトログリセリンの説明で正しいものはどれか,冠状動脈を拡張し、虚血部位への血流を改善する,気管支の平滑筋を弛緩させ、気道を拡張する,生体内での血液凝固を阻止し、血栓ができないようにする,強力な鎮痛作用を持ち、術後やがんの疼痛緩和に用いられる,正解：冠状動脈を拡張し、虚血部位への血流を改善する\n気道を拡張させるはβ作作用薬です。血栓ができなくするのはワルファリンです。鎮痛作用を持つものはモルヒネです。2025年2月准看テストにあります。,img/1377.png,成人
8-8,ウイルスや細菌などの感染が原因となる循環器疾患はどれか,心筋炎,下肢静脈瘤,心室中隔欠損症,動脈硬化症,正解：心筋炎\n2025年2月准看テストにあります。,img/1378.png,成人
8-9,ペースメーカー埋め込み術を受けた患者の指導内容で適切でないものはどれか,電子機器による電波干渉は気にしなくてよい,ペースメーカー手帳を常に携帯する,毎日脈拍を測定し、作動を確認する,定期的に外来を受診する,正解：電子機器による電波干渉は気にしなくてよい\nしなければなりません。2025年2月准看テストにあります。,img/1379.png,成人
8-10,誤っているものはどれか,吐血とは肺や気道からの出血である,消化器疾患以外でも腹痛はみられる,胸やけとは、心窩部から胸骨後面にかけて焼けるような感じを言う,腹膜の炎症による腹水は浸出液である,正解：吐血とは肺や気道からの出血である\n吐血は消化器からの出血です。2025年2月准看テストにあります。,img/1380.png,成人
8-11,マックバーネ点の圧痛を特徴とする疾患はどれか,急性虫垂炎,胆石症,胃がん,肝硬変,正解：急性虫垂炎\nマックバーネー点は右下腹部です。2025年2月准看テストにあります。,img/1381.png,成人
8-12,大腸がんの検査で行わないものはどれか,フッシュバーグ濃度試験,問診,直腸指診,便潜血検査,正解：フィッシュバーグ濃度試験\n尿の検査です。2025年2月准看テストにあります。,img/1382.png,成人
8-13,胃十二指腸潰瘍の患者の食事指導について適切なものはどれか,糖質は胃粘膜への刺激が少ない,アルコール制限はない,酢やレモン汁・香辛料で味を調える,胃粘膜の負担軽減のために食事間隔をあける,正解：糖質は胃粘膜への刺激が少ない\nアルコール制限はあります。胃への刺激を抑えるため刺激物の摂取は控えます。食事の間隔は一日三食の定められた時間です,img/1383.png,成人
8-14,貧血のある患者の看護について正しいものはどれか,めまいや立ち眩みで転倒しやすいことを説明する,活動制限は必要ない,貧血時は代謝が向上するため冷罨法を行う,たんぱく質の摂取は制限する,正解：めまいや立ち眩みで転倒しやすいことを説明する\n貧血は活動の制限があります。また、保温をし良質なたんぱく質を摂取します。2025年2月准看テストにあります。,img/1384.png,成人
8-15,造血幹細胞移植とその看護について正しいものはどれか,危険度の高い治療であり本人の意思決定支援が重要である,白血病の診断後早期に行われる治療である,移植前は普通の生活が可能である,移植後は感染に注意しなくてよい,正解：危険度の高い治療であり、本人の意思決定支援が重要である\n造血幹細胞移植とは正常な血液細胞を作ることができなくなった患者に造血幹細胞を移植する治療法であり、白血病やリンパ腫などの治療法です。2025年2月准看テストにあります。,img/1385.png,成人
8-16,バセドウ病で分泌過剰となるホルモンはどれか,甲状腺ホルモン,成長ホルモン,コルチゾール,アルドステロン,正解：甲状腺ホルモン\n成長ホルモンが過多になると先端巨大症が発症します。コルチゾールが過多になるとクッシング症候群になります。アルドステロンが過多になると原発性アルドステロン症となります。2025年2月准看テストにあります。,img/1386.png,成人
8-17,糖尿病患者へのフットケア指導について正しいものはどれか,こたつなどによる低温やけどに注意する,魚の目は自分で削る,できるだけ裸足で過ごす,靴は大きめのものを選ぶ,正解：こたつなどによる低温やけどに注意する\n糖尿病患者へのフットケアは傷がつかないよう保護し毎日観察することが重要です。魚の目などは処置が必要です。靴はちょうどよいものを選びます。2025年2月准看テストにあります。,img/1387.png,成人
8-18,尿路結石患者への看護について適切でないものはどれか,自然排泄のための安静を進める,飲水を進める,疼痛の除去につとめる,再発防止のために生活指導を行う,正解：自然排泄のために安静を進める\n排尿は安静を進めると出にくくなります。2025年2月准看テストにあります。,img/1388.png,成人
8-19,膀胱炎の患者について適切なのはどれか,排泄時の陰部清潔保持の方法について指導する,急性膀胱炎は男性に多い,尿の混濁は見られない,水分摂取を控えるように指導する,正解：排泄時の陰部清潔保持の方法について指導する\n膀胱炎の好発は女性です。尿の混濁が見られます。水分は多くとることが大切です。2025年2月准看テストにあります。,img/1389.png,成人
8-20,マヒがないが裏返した洋服を着ることができない場合、考えられる高次脳機能障害はどれか,失認,見当識障害,失語,失行,正解：失認\n言語・行為・記憶・認知・判断などに障害が出た状態を高度脳機能障害といいます。2025年2月准看テストにあります。,img/1390.png,成人
8-21,脳波検査が診断に有効な疾患として最も適切なものはどれか,てんかん,脳梗塞,頭蓋骨骨折,髄膜炎,正解：てんかん\n脳波検査とは、頭皮に電極を付けて脳の電気活動を測定する検査です。2025年2月准看テストにあります。,img/1391.png,成人
8-22,脳腫瘍について正しいものはどれか,CTやMRIが診断に有効である,頭蓋内圧が低下する,グリオーマは基本的に良性である,転移性脳腫瘍の原発巣として消化器がんが最も多い,正解：CTやMRIが診断に有効である\n脳腫瘍では頭蓋内圧は高くなります。グリオーマは悪性であることが多いです。原発巣は肺や乳腺であることが多いです。2025年2月准看テストにあります。,img/1392.png,成人
8-23,アレルギー性鼻炎患者への指導について適切なのはどれか,マスクを着用する,ほこりが出るので掃除は控える,季節を問わず頻繁に窓を開けて喚起する,布団は外に干す,正解：マスクを着用する\n清潔のため掃除はこまめにします。アレルゲンが外に多い場合は窓をなるべく開けないようにします。布団は週に一度は洗うようにします。2025年2月准看テストにあります。,img/1393.png,成人
8-24,全身性エリテマトーデスとその看護について正しいものはどれか,蝶形紅斑を生じることが多い,男性に多い,直射日光にあたるとよい,中枢神経障害が生じることはない,正解：蝶形紅斑を生じることが多い\n膠原病は女性に多いです。直射日光は避けるようにします。全身性エリテマトーデスの中枢神経障害として有名なものはうつ病です。2025年2月准看テストにあります。,img/1394.png,成人
8-25,帯状疱疹について正しいものはどれか,感染の既往として水痘がある,神経痛や神経麻痺が生じる,疲労によって症状が悪化することはない,単純ヘルペスウイルスの感染が主な原因である,正解：感染の既往歴として水痘がある\n帯状疱疹による神経痛は帯状疱疹後神経痛といいます。疲労によって症状が悪化することもあります。水痘ウイルスが原因です。2025年2月准看テストにあります。,img/1395.png,成人
8-26,女性生殖器疾患で下腹部痛がある患者の看護について誤っているものはどれか,医師に報告する必要はない,不正性器出血の有無を観察する,月経や妊娠の有無を観察する,疼痛が緩和されるように体位を工夫する,正解：医師に報告する必要はない\n医師に報告します。2025年2月准看テストにあります。,img/1396.png,成人
