id,question,choice1,choice2,choice3,choice4,explanation,img,category
8-670,不整脈について正しいのはどれか,不整脈とは正常洞調律（60～100/分）から逸脱したものをいう,心室期外収縮は心電図上、QRS波の前にP波を伴う,心房細動に対しては直ちに心肺蘇生術を施行する,房室ブロックは頻脈性不整脈である,正解：不整脈とは正常洞調律（60～100/分）から逸脱したものをいう\n不整脈とは正常洞調律（60～100/分）から逸脱したものをいう\n期外収縮はｐ波は欠如します。心肺蘇生術を直ちに必要とするのは心室細動です。房室ブロックは徐脈性不整脈です。成人看護（循環器疾患患者の看護）にあります。,img/2039.png,成人
8-671,虚血性心疾患について正しいのはどれか,狭心症と心筋梗塞が代表的な疾患である,労作性狭心症は冠動脈の一時的な痙攣が原因で起こる,心筋梗塞にはニトログリセリンの投与が有効である,急性心筋梗塞では通常、異常Q波の出現後にSTの上昇が現れる,正解：狭心症と心筋梗塞が代表的な疾患である\n労作性狭心症は運動や身体的なストレスによって心筋への血流が不足し胸痛や圧迫感を引き起こす心臓の病気です。冠動脈の一時的な痙攣は痙攣縮性狭心症です。ニトログリセリンは狭心症に有効です。急性心筋梗塞ではST上昇後に異常Q歯が出現します。成人看護（循環器疾患患者の看護）にあります。,img/2040.png,成人
8-672,狭心症の治療で行われるのはどれか,冠動脈バイパス術,永久ペースメーカー植え込み術,植え込み型除細動器手術,カテーテルアブレーション,正解：冠動脈バイパス術\nペースメーカー植え込み術は房室ブロックに用いられます。植え込み除細動器手術は心室頻拍や心室細動を防ぐために行われます。カテーテルアブレーションはWPW症候群に行われます。成人看護（循環器疾患患者の看護）にあります。,img/2041.png,成人
8-673,狭心症患者の看護について正しいのはどれか,外出時でもニトログリセリンを携帯しておくことを説明する,初期にはきりっぷ分類によって重症度を評価する,水分出納を厳密に観察する,心負荷をかけないよう絶飲食とする,正解：外出時でもニトログリセリンを携帯しておくことを説明する\nキリップ分類は急性心筋梗塞における心機能障害の重症度を評価するための分類です。水分出納は厳密な観察は必要ありません。狭心症は減塩をするとともにバランスの取れた食事と適度な運動が大切です。成人看護（循環器疾患患者の看護）にあります。,img/2042.png,成人
8-674,次のうち正しいのはどれか,痰飲患者の平均在日日数が最も多い傷病者は精神および行動の障害である,我が国における令和元年の有症率が最も高い年代は60歳代であり症状別では肩こりが最も多い,抗菌薬に湯折る監置が可能なことから梅毒の罹患率は減少傾向にある,我が国における令和4年の30～40歳代男女の死因順位第1位は自殺である,正解：退院患者の平均在日日数が最も多いの傷病は精神および行動の障害である\n30台までの死因は自殺が一位です。有症率で最も多いのは生活習慣病です。梅毒は増加傾向にあります。実力テスト⑥にあります。,img/2043.png,成人
8-675,呼吸器疾患と検査の組み合わせで正しいのはどれか,肺結核ーーー喀痰塗擦検査,サルコイドーシスーーー細菌培養,気管支喘息ーーー気管支鏡,慢性閉塞性肺疾患ーーー肺生検,正解：肺結核ーーー喀痰塗擦検査\nサルコイドーシスでは組織政権を行います。気管支喘息、慢性閉塞性肺疾患ではスパイロメトリーで診断を行います。実力テスト⑥にあります。,img/2044.png,成人
8-676,肺がんについて誤っているのはどれか,血行性転移により癌性胸膜炎を起こす,肺腺癌は肺野末梢部に発症しやすい,扁平上皮癌は喫煙との関係が深い,麻痺の症状がみられる場合は脳転移を疑う,正解：血行性転移によりがん性胸膜炎を起こす\nがん性胸膜炎は浸潤性転移です。実力テスト⑥にあります。,img/2045.png,成人
8-677,気管挿管による人工呼吸を受ける患者の看護について適切なのはどれか,気管チューブのカフ圧が高すぎると気管の壊死を起こす,意思の疎通は容易である,乾燥した空気を肺胞に送る必要がある,自発呼吸と人工呼吸が同調した状態をファイティングという,正解：気管チューブの科負圧が高すぎると気管の壊死を起こす\n気管挿管中の患者の意思疎通には工夫が必要です。空気は湿らせるひつようがあります。自発呼吸等人工呼吸が同調しない状態をファイティングといいます。実力テスト⑥にあります。,img/2046.png,成人
8-678,気管支喘息患者の看護について適切でないのはどれか,ステロイド吸引療法後はうがいをしないように指導する,高度な発作や銃と受な状態に備えて気管挿管の準備をしておく,呼吸困難時は起座位をとらせる,正しく吸入薬を使用できるように指導する,正解：ステロイド吸入療法後はうがいをしないよう指導する\nステロイド吸入後は語らずうがいを促します。実力テスト⑥にあります。,img/2047.png,成人
8-679,心音について正しいのはどれか,二音は大動脈弁と肺動脈弁が閉じる音である,一音は心室が拡張し始めるときに生じる,一音は僧帽弁と三尖弁とが開く音である,二音は心室が収縮し始めるときに生じる,正解：二音は大動脈弁と肺動脈弁とが閉じる音である\n心臓の第一音は心室の収縮が始まるタイミングで起き房室弁が閉じる音です。第二音は心室の収縮が終わり拡張が始まるときにおき、大動脈弁と肺動脈弁が閉じる音です。実力テスト⑥にあります。,img/2048.png,成人
8-680,心臓弁膜症について正しいのはどれか,僧帽弁狭窄症では左房圧が上昇し肺うっ血をきたす,大動脈弁狭窄症は右心室の負荷をきたす,大動脈弁閉鎖不全症の原因は先天性である,僧帽弁閉鎖不全症では収縮期に右心室から右心房へ血液の逆流を生じる,正解：僧帽弁狭窄症では左心圧が上昇し、肺うっ血をきたす\n大動脈弁狭窄症は左心室に負荷がかかります。大動脈弁閉鎖不全症は加齢や高血圧などにより起こります。左心房と左心室の逆流が起こります。実力テスト⑥にあります。,img/2049.png,成人
8-681,狭心症についてただしいのはどれか,冠危険因子には高血圧や糖尿病がある,労作性心筋症の原因は冠動脈の痙攣である,前胸部痛は30分以上持続する,生三役は発作前に服用しないと効果がない,正解：冠危険因子には高血圧や糖尿病がある\n労作性心筋症の原因はプラークによる狭窄です。前胸部痛は30分以内に収まるものが狭心症です。それ以上持続する場合は心筋梗塞を疑います。ニトログリセリンは発作中に服用します。実力テスト⑥にあります。,img/2050.png,成人
8-682,大動脈解離で用いられる分類はどれか,スタンフォード分類,NYHA新機能分類,キリップ分類,フォレスター分類,正解：スタンフォード分類\nNYHA心機能分類は自覚症状について心不全の重症度を分けた指標です。キリップ分類は急性心不全の十条度を心不全症状や物理的職権に基づいて4段階に分類したものです。フォレスター分類は急性心筋梗塞などに対して心臓カテーテル検査で得られる神経すると肺動脈欅入圧を用いて分類する指標です。実力テスト⑥にあります。,img/2051.png,成人
8-683,胃がんの転移について正しい組み合わせはどれか,卵巣転移ーーークルッケンベルグ腫瘍,腎臓転移ーーーウィルムス腫瘍,肝臓転移ーーーシュニッツラー転移,胃周囲リンパ節転移ーーーウィルヒョウ転移,正解：卵巣転移ーーークルッケンベルグ腫瘍\n腎臓転移は腎転移などと呼ばれます。シュニッツラー転移はダグラス窩への転移です。ウィルヒョウ転移は左鎖骨下リンパ節への転移です。ウィルムス腫瘍は腎臓を原発とする小児に多い腫瘍です。実力テスト⑥にあります。,img/2052.png,成人
8-684,肝硬変について正しいのはどれか,肝細胞癌の発症率が上がる,門脈圧が低下する,飲酒によるものが最も多い,肝性脳症の徴候があるときは高たんぱく食とする,正解：肝細胞癌の発症率が上がる\n門脈圧は上昇します。飲酒によるものは年々増えていますがまだ肝炎ウイルスによるものが多いです。肝性脳症発症時は低たんぱく食となります。実力テスト⑥にあります。,img/2053.png,成人
8-685,胃がんで開腹手術を受けた患者の看護について適切なのはどれか,深部静脈血栓予防のため早期離床をすすめる,早期ダンピング症候群は食後2～3時間後に出現する,後期ダンピング症候群は食物が吸収されていないことによる低血糖症状である,食事は一回量を増やすように指導する,正解：深部静脈血栓症を予防するため早期離床をすすめる\n早期ダンピング症候群は食後30以内に出現します。後期ダンピング症候群は食べ物が急速に吸収されインスリンが過剰に分泌されることによる低血糖症状です。食事は一回量を少なくし回数を増やします。実力テスト⑥にあります。,img/2054.png,成人
8-686,胆道ドレナージを受ける患者の看護で適切なのはどれか\na.電解質バランスの異常の有無を観察する\nb.黄疸の消退を促す目的で行うと説明する\n.チューブが屈曲しても問題ないことを説明する\nd.急激に排液量が減少したら抜去できると説明する,a and b,a and d,b and c,c and d,正解：a and ｂ¥チューブの屈曲は避けます。急激に排液量が減少したら閉塞を疑います。実力テスト⑥にあります。,img/2055.png,成人
8-687,血液疾患について誤っているのはどれか,急性リンパ性白血病は高齢者に多い,腎性貧血にはエリスロポエチンの予約が有効である,鉄欠乏性貧血の特徴的な症状としてさじ状爪があげられる,多発性骨髄腫では病的骨折による腰痛が出現することが多い,正解：急性リンパ性白血病は高齢者に多い\n小児に多いです。実力テスト⑥にあります。,img/2056.png,成人
8-688,血友病Aの原因となる凝固因子はどれか,第Ⅷ因子,第5因子,第9因子,第10因子,正解：第8因子\n血友病Bが第Ⅸ因子です。実力テスト⑥にあります。,img/2057.png,成人
8-689,下垂体ホルモンの不足によって生じる疾患について正しいのはどれか,中枢性尿崩症,クッシング病,褐色細胞腫,プロラクチノーマ,正解：中枢性尿崩症\nクッシング病は副腎皮質刺激ホルモンの分泌過剰によるコルチゾールの過剰分泌です。褐色細胞腫はアドレナリンやノルアドレナリンを過剰に分泌する副腎の腫瘍です。プロラクチノーマは脳下垂体の腫瘍によるプロラクチンの過剰分泌です。実力テスト⑥にあります。,img/2058.png,成人
8-690,低血糖症状とその看護で正しいのはどれか\na.一般的に血糖値が100㎎/dl以下になると症状が強くなる\nb.意識レベルの低下・冷や汗・首足の震えなどがみられる\nc.経口摂取が可能であればぶどう糖10ｇを服用させる\nd.退所後1時間後に血糖を測定する,d and c,a and b,a and d,c and d,正解：b and c\n低血糖症状は60㎎/dl未満で出現します。症状出現時の血糖が大切です。実力テスト⑥にあります。,img/2059.png,成人
8-691,糖尿病末梢神経障害による感覚障害のある患者のフットケアの指導で適切なのはどれか,両側部の観察する,熱めの湯をかけて洗う,なるべく素足で過ごす,爪は足趾の先端よりも短く切る,正解：両側部を観察する\nお湯はぬるめとします。なるべく靴下を履いて過ごすようにします。爪はストレートカットとします。実力テスト⑥にあります。,img/2060.png,成人
8-692,透析を受ける患者の看護について正しいのはどれか,シャント音の確認を行う必要性を説明する,血液透析・腹膜透析ともに透析施設に通う必要があることを説明する,透析期間中の体重増加の目安は目標体重の10％であることを説明する,血圧測定や採血はどちら側の腕で行っても構わないと説明する,正解：シャント音の確認を行う必要性を説明する\n腹膜透析の手技は自分で行います。透析期間の体重増加の目安は6％未満に抑えることが望ましいです。血圧測定や採血はシャントがない側の腕で行います。実力テスト⑥にあります。,img/2061.png,成人
8-693,ネフローゼ症候群患者について正しいのはどれか,薬物療法として副腎皮質ステロイド薬や免疫抑制薬が用いられる,浮腫が高度の場合は循環血液量が増加っして末梢冷感になりやすい,6g～10g/標準体重kgのタンパク量に保つ,病気や腎機能の程度により日常生活の制限が異なることはない,正解：薬物療法として副腎皮質ステロイド薬や免疫抑制薬が用いられる\nネフローゼ症候群の浮腫は血中のアルブミンが低下することによって膠質浸透圧が変化し起こる浮腫です。タンパク量は体重1kg当たり0.6～0.8ｇとします。ネフローゼ症候群では安静が必要となります。実力テスト⑥にあります。,img/2062.png,成人
8-694,尿路結石患者の看護について正しいのはどれか,側腹部からは胃部への疼痛の程度を観察する,顕微鏡的血尿は見られない,結石の排出を促すために安静にする,疝痛発作に対して鎮痛薬・鎮座薬は禁忌である,正解：側腹部からは胃部への疼痛の程度を観察する\n顕微鏡的血尿が見られることがあします。結石の排出には運動が有効です。疝痛発作に対しては鎮痛薬などを用います。実力テスト⑥にあります。,img/2063.png,成人
8-695,パーキンソン病のヤール重症度分類で姿勢反射障害が出現し転倒のリスクが高まるのはどれか,ステージ3,ステージ１,ステージ２,ステージ5,正解：ステージ3\nパーキンソン病のヤール重症度分類では、ステージ3で姿勢反射障害が出現し転倒のリスクが高まります。実力テスト⑥にあります。,img/2064.png,成人
8-696,多発性硬化症について誤っているのはどれか,末梢神経が障害されることが多い,脱髄病変が多発する,視力障碍が出現し失明することがある,MRIは病変の検出に有効である,正解：末梢神経が障害されることが多い\n中枢神経が障害する自己免疫が生成される病気です。実力テスト⑥にあります。,img/2065.png,成人
8-697,発作直後のくも膜下出血患者の看護に適切でないのはどれか,髄液が無色透明であることを確認する,再出血の予防に努める,疼痛コントロールを行う,排便コントロールを行う,正解：髄液が無色透明であることを確認する\n髄液は血液が混ざり混濁します。実力テスト⑥にあります。,img/2066.png,成人
8-698,成人期のアトピー性皮膚炎について正しいのはどれか,乾燥性の苔癬化が見られる,ほかのアレルギー性疾患を合併することはない,IgAが上昇する,ステロイド外用薬は効果がない,正解：乾燥性の苔癬化が見られる\nアトピー性皮膚炎はアレルギー性の疾患のため他のアレルギーを併発することあります。IgEの上昇がみられます。ステロイド外用薬が有効です。実力テスト⑥にあります。,img/2067.png,成人
8-699,全身性エリテマトーデスについて正しいのはどれか\na.遺伝的訴因に関係なく紫外線の被ばくによって発症する\nb.男性に多い疾患である\nc.中枢神経は生命予後に影響する\nd.特徴的な症状として顔面にあらわれる蝶形紅斑がある,c and d,a and b,a and d,b and c,正解：c and d\n全身性エリテマトーデスは遺伝的要素が影響します。女性に多いです。実力テスト⑥にあります。,img/2068.png,成人
8-700,敗血症について誤っているのはどれか,症候は局所にとどまる,初期症状に頻脈がある,基礎疾患や医療行為が一因となることがある,播種性血管内凝固症候群を併発することがある,正解：症候は局所にとどまる/n全身性の疾患です。実力テスト⑥にあります。,img/2069.png,成人
8-701,女性生殖器疾患の検査について正しいのはどれか,子宮卵管造影ではアレルギー症状の出現に注意する,内診時はシムス位を取る,超音波断層検査は膣以外から行うことはできない,ダグラス窩穿刺は子宮外妊娠の疑いがあるがあるは禁忌である,正解：子宮卵管造影法ではアレルギー症状の出現に注意する\n内診時の体位は膝外位です。超音波断層検査は腹部からも行うことができます。だ具楽化穿刺は子宮外妊娠の検診につ用います。実力テスト⑥にあります。,img/2070.png,成人
8-702,不妊症患者の看護について適切なのはどれか,不妊治療には家族の理解が重要であると説明する,不妊症期間やこれまでの治療の内容については情報収集してはいけない,不妊症検査スケジュールについては2週間で終わると説明する,治療は3か月で終了すると説明する,正解：不妊治療には家族の理解が重要であると説明する\n不妊治療は長期になります。不妊期間やこれまでの治療内容の情報収集が必要です。実力テスト⑥にあります。,img/2071.png,成人
8-703,脊髄損傷患者の寛喜について正しいのはどれか,自己導尿の必要性と方法を説明する,急性期の体位変換は禁忌である,水分制限の必要を説明する,他動運動は障害受容ができるまで待つ,正解：自己導尿の必要性と方法を説明する\n急性期も体位変換は行います。水分制限はありません。他動運動は急性期から積極的に行います。実力テスト⑥にあります。,img/2072.png,成人
8-704,腓骨神経麻痺防止のための看護について適切でないのはどれか,下肢の肢位は外旋位とする,麻痺がおこると下垂足となる場合があることを説明する,枕やタオルを使用し腓骨頭部の圧迫しないように工夫する,第1踵周囲の感覚異常を観察する,正解：下肢の肢位は外旋位とする\n外旋位は腓骨神経麻痺を助長します。実力テスト⑥にあります。,img/2073.png,成人
8-705,パッチテストについて正しいのはどれか,接触性皮膚炎の原因物質を特定するために行われる,通常、皮膚に貼付して24時間後の皮膚反応を見る,貼布部位は前腕前屈や腹部である,絆創膏をはがした直後に判定する,正解：接触皮膚炎の原因物質を特定するために行われる\n皮膚反応は48時間後に確認します。貼布部位は前腕内側や背部が選ばれます。絆創膏ははがした30分後に判定します。実力テスト⑥にあります。,img/2074.png,成人
8-706,緑内障について誤っているのはどれか,正常眼圧緑内障の方が眼圧が高い緑内障よりも多い,開放隅角緑内障は自覚症状が少ない,点眼や内服での治療が基本であり、手術を行うことはない,点眼薬の使用による縮瞳により暗いところが見えにくくなる,正解：正常眼圧緑内障の方が眼圧の高い緑内障よりも多い\n眼圧の高い緑内障の方が多いです。実力テスト⑥にあります。,img/2075.png,成人
8-707,感音難聴の障害部位はどこか,聴神経,外耳道,鼓膜,耳管,正解：聴神経\n感音性難聴は内耳や聴神経による難聴です。実力テスト⑥にあります。,img/2076.png,成人
8-708,メニエール病について正しいのはどれか\na.繰り返す回転性めまい発作が特徴である\nb.耳鳴りや難聴を伴うことはない\nc.外耳の疾患である\nd.十分な睡眠ととも塩分を控えるように指導する,a and d,a and b,b and c,c and d,正解：a and d\nメニエール病の原因は内リンパ水腫であるため内耳の障害です。耳なり、難聴、めまいが特徴です。実力テスト⑥にあります。,img/2077.png,成人
8-709,次のうち誤っているのはどれか,歯垢は食物の食べ残しが集まったものである,口腔がんの中では舌癌の発生が多い,象牙質まで進行したう蝕はう蝕症第2度に分類される,歯周病は歯肉や思想に炎症が及び歯槽骨が吸収される,正解：歯垢は食物の食べ残しが集まったものである\n歯垢は細菌により形成されます。実力テスト⑥にあります。,img/2078.png,成人
9-1,加齢による体の変化について誤っているものはどれか,水晶体や毛様体の調節機能が向上する,円背になりやすい,皮脂の分泌が低下する,基礎代謝が低下する,正解：水晶体や毛様体の機能が向上する\n高齢者は各所の機能が低下します。2025年2月准看テストにあります。,img/2079.png,老年
9-2,老年期のハヴィガーストの発達課題はどれか,配偶者の死に対応する,子供を育てる,市民としての責任を引き受ける,気のある社交グループを見つけ出す,正解：配偶者の死に対応する\n2025年2月准看テストにあります。,img/2080.png,老年
9-3,前期高齢者の年齢区分について正しいものはどれか,65～74歳,60～69歳,60～70歳,65～75歳,正解：65～74歳\n2025年2月准看テストにあります。,img/2081.png,老年
9-4,介護保険法における要支援及び要介護認定区分はどれか,要支援1～2・要介護1～5,要支援1・要介護1～3,要支援1～2・要介護1～3,要支援1～3・要介護1～5,正解：要支援1～2・要介護1～5\n2025年2月准看テストにあります。,img/2082.png,老年
9-5,疾病に罹患した高齢者の特徴について適切なものはどれか,治癒に時間を要し慢性化しやすくなる,症状や経過は典型的である,合併症は起こしにくい,症状が急変することはまれである,正解：治癒に時間を要し慢性化しやすい\n高齢者は体の諸機能が低下するため症状は発見しにくく合併症が多く、急変しやすいです。2025年2月准看テストにあります。,img/2083.png,老年
9-6,次のうち高齢者虐待ではないものはどれか,エンパワメント,暴言,財産の不当処分,介護放棄,正解：エンパワメント\nエンパワメントは権限を持たせること、自信を持たせることという意味です。2025年2月准看テストにあります。,img/2084.png,老年
9-7,高齢者とのコミュニケーションにおいて適切なものはどれか,視線を合わせる,にぎやかな場所で会話する,タッチング・マッサージは避ける,表情による表現は有効でない,正解：視線を合わせる\n聴力が低下しているためにぎやかな場所での会話は避けます。タッチング・マッサージは有効です。表情による表現も有効です。2025年2月准看テストにあります。,img/2085.png,老年
