id,question,choice1,choice2,choice3,choice4,explanation,img,category
1-1,器官と器官を接合する働きを持つものはどれか,支持組織,筋組織,神経組織,上皮組織,正解：支持組織\n2025年二月准看テストにあります,img/1.png,人体
1-2,下肢にある骨について正しいものはどれか,腓骨,橈骨,鎖骨,蝶形骨,正解：腓骨\n橈骨は上腕にあります。鎖骨は肩にあります。蝶形骨は頭部にあります。2025年2月准看テストにあります,img/2.png,人体
1-3,成人の正常は赤血球の説明で正しいものはどれか,酸素の輸送を担っている,球状の細胞である,腎臓で破壊される,寿命は約60日である,正解：酸素の輸送を担っている\n赤血球は中央がくぼんだ形をしています。また脾臓、肝臓、骨髄で破壊され、寿命は120日です。2025年2月准看テストにあります,img/3.png,人体
1-4,次のうち正しいのはどれか,血管は動脈・静脈・毛細血管に区別される,肺静脈には静脈血が流れている,動脈は内膜と外膜の2層からなる,人体の血液循環には全身の血液を送るがある,正解：血管は静脈・動脈・毛細血管に区別される\n肺静脈には動脈血が流れます。動脈は内膜・中膜・外膜の3層らなります。人体の血液循環には全身の血液を送るのは体循環です。2025年2月准看テストにあります,img/4.png,人体
1-5,呼吸の生理について正しいものはどれか,横隔膜の上下運動による呼吸を腹式呼吸という,呼吸中枢は小脳にある,外肋間筋の収縮により胸腔は狭まる,肺で行われる酸素と二酸化炭素の交換を内呼吸という,正解：横隔膜の上下運動による呼吸を腹式呼吸という,img/5.png,人体
1-6,インスリンについて正しいものはどれか,ランゲルハンス島のβ細胞から分泌される,血糖値を上げる作用がある,肝臓や筋肉でグリコーゲンを分解する,分泌が過剰になると糖尿病になる,正解：ランゲルハンス島のβ細胞から分泌される\nインスリンには血糖値を下げる効果があります\n肝臓はグリコーゲンを蓄え、筋肉はグリコーゲンをエネルギーとして使用します。インスリンの分泌が低下すると糖尿病になります。2025年2月准看テストにあります,img/6.png,人体
1-7,次のうち誤っているものはどれか,腎小体のことをネフロンという,右腎は左腎よりも低い位置にある,腎小体でろ過された原尿は尿細管へと流れていく,尿管には3か所の生理的狭窄部がある,正解：腎小体のことをネフロンという\nネフロンは腎小体+尿細管です2025年2月准看テストにあります,img/7.png,人体
1-8,皮膚感覚でないのはどれか,味覚,痛覚,温度覚,触圧覚,正解：味覚\n味覚は舌の感覚です。2025年2月准看テストにあります,img/8.png,人体
1-9,言語活動と関係が深いのはどれか,大脳皮質,橋,脊髄,視床下部,正解：大脳皮質\n橋は神経伝達物質のバランスを調整しています。脊髄は脳と体をつなぐ神経の束です。視床下部はホルモンの分泌をしています,img/9.png,人体
1-10,細胞内にある遺伝情報を有する核内物質について正しいものはどれか,DNA,リボソーム,ゴジル装置,ミトコンドリア,正解：DNA\n他の選択肢は細胞内小器官です。リボソームはたんぱく質の合成を行います。ゴジル装置は細胞内物質の梱包発送を行います。ミトコンドリアはATPの合成を行います。2025年9月准看テストにあります,img/10.png,人体
1-11,次のうち誤っているものはどれか,短期間で大きな力を要する運動は主として有酸素運動である,肋間筋は呼吸運動に関与する,骨格筋の両端は腱を介して骨に付着する,骨格筋は横紋筋である,正解：短期間で大きな力を要する運動は主として有酸素運動である\n無酸素運動です。有酸素運動は軽～中等度の負荷を長時間行う運動のことです。2025年9月准看テストにあります,img/11.png,人体
1-12,血液系について誤っているものはどれか,成人の赤血球の寿命は約30日である,成人の赤血球は骨髄で作られる,血小板は止血に関与する,白血球は炎症性疾患で増加する,正解：成人の赤血球の寿命は約30日である\n赤血球の寿命は120日です。2025年9月准看テストにあります,img/12.png,人体
1-13,心電図におけるP波は何を表すか,心房の興奮,心室の興奮,心室の興奮の消退,心室に興奮が始まってから終わるまでの時間,正解：心房の興奮\n心室の興奮はQRS波によってあらわされます。心室の興奮の消退はT波によってあらわされます。心室に興奮が始まってから終わるまでの時間はQT間隔です。2025年9月准看テストにあります,img/13.png,人体
1-14,肺の構造について正しいものはどれか,肺の上部を肺尖と呼ぶ,肺の底部を肺門と呼ぶ,左肺は上葉・中葉・下葉の三葉に分けられる,右肺は上葉・下葉の二葉に分けられる,正解：肺の上部を肺尖と呼ぶ\n肺門は気管支や血管が肺に出入りするところです。右肺は上葉・中葉・下葉の三葉に分けられ、左肺が上葉・下葉の二葉に分けられます。2025年9月准看テストにあります,img/14.png,人体
1-15,胆汁について正しいものはどれか,第十二指腸乳頭（ファーター乳頭）から排出される,胆嚢で作られる,たんぱく質の消化を助ける,大腸で再吸収される,正解：第十二指腸乳頭（ファーター乳頭）から排出される\n胆汁は肝臓で作られます。脂質の消化を助けます。小腸で再吸収されます。2025年9月准看テストにあります,img/15.png,人体
1-16,成人男性の1日の糸球体ろ過量（GFR）について適切なものはどれか,約180L,約125mL,約1.5L,約10L,正解：約180L\n2025年9月准看テストにあります,img/16.png,人体
1-17,副腎ホルモンの働きについて正しいものはどれか,抗炎症作用がある,抗利尿作用がある,骨の成長を促進する,血糖値を下げる,正解：抗炎症作用がある\n抗利尿作用があるのはバソプレシンです。骨の成長を促進するのは成長ホルモンです。血糖値を下げるのはインスリンです。2025年9月准看テストにあります,img/17.png,人体
1-18,平衡感覚を司るのはどこか,半規管,鼓膜,鼓室,耳管,正解：半規管\n鼓膜・鼓室・耳管は聴覚に関与します。2025年9月准看テストにあります,img/18.png,人体
1-19,次の中で上皮組織が存在しないのはどれか,心筋,肛門,胃,気管支,正解：心筋\n肛門は重層扁平上皮です。胃は単層円柱上皮です。気管支は絨毛上皮です。2025年11月准看テストにあります,img/19.png,人体
1-20,骨の構造と機能について誤っているのはどれか,黄色骨髄には造血作用がある,骨は骨膜・骨質・骨髄からなる,骨の主な成分はカルシウムとコラーゲンである,骨組織の維持には骨芽細胞と破骨細胞が必要である,正解：黄色骨髄には造血作用がある\n造血作用は赤色骨髄にあります。2025年11月准看テストにあります,img/20.png,人体
1-21,血液型について正しいのはどれか,ABO式血液型の抗原は赤血球にある,Rh式血液型の抗原は白血球にある,AB型の血清の凝集素は抗A抗体および抗B抗体である,O型の血清には凝集素がない,正解：ABO式血液型の抗原は赤血球にある\nRh型の抗原は赤血球にあります。AB型には凝集素が含みません。O型にはA型、B型両方の凝集素が含みます。2025年11月准看テストにあります,img/21.png,人体
1-22,リンパの流れで正しいのはどれか,腹腔内にあるリンパ管の集合部位を乳糜層という,リンパ管には弁がない,右上半身のリンパは胸管に流入する,リンパの流れは動脈と同方向である,正解：胸腔内にあるリンパ管の集合部位を乳糜層という\nリンパ管には弁があります。右上半身のリンパは右リンパ本管に流入します。リンパの流れは静脈と同方向です。2025年11月准看テストにあります,img/22.png,人体
1-23,呼吸の生理について正しいのはどれか,血液中の二酸化炭素分圧は呼吸中枢に最も影響を与える,肺でのガス交換を内呼吸という,吸息時には横隔膜は弛緩する,呼吸中枢は小脳にある,正解：血液中の二酸化炭素分圧は呼吸中枢に最も影響を与える\n肺でのガス交換は外呼吸です。吸息時には横隔膜は収縮します。呼吸中枢は延髄にあります。2025年11月准看テストにあります,img/23.png,人体
1-24,成人の食道の構造で正しいのはどれか,3か所の生理的狭窄部位がある,胃の幽門につながる,上1/3が平滑筋である,長さは全長45CMである,正解：3か所の生理的狭窄部位がある\n食道は噴門につながります。胃は全部が平滑筋です。長さは15㎝ほどです。2025年11月准看テストにあります,img/24.png,人体
1-25,腎臓から分泌されるのはどれか,a and b,a and d,b and c,c and d,正解：a and b\nアンギオテンシン、アルドステロンは副腎から分泌されるホルモンです。2025年11月准看テストにあります,img/25.png,人体
1-26,交感神経の興奮によって起こる眼の反応はどれか,散瞳,流涙,明暗順応,対光反射,正解：散瞳\n流涙、明暗順応、対光反射は副交感神経の興奮によっておこります。2025年11月准看テストにあります,img/26.png,人体
1-27,脊髄神経について正しいのはどれか,坐骨神経は脊髄神経の一つである,中枢神経である,左右25対ある,運動神経は脊髄後根から出る,正解：坐骨神経は脊髄神経の一つである\n脊髄神経は末梢神経です。左右26対あります。運動神経は前根から出て後根に伝えます。2025年11月准看テストにあります,img/27.png,人体
1-28,人体各部の名称について、正しいものはどれか,膝から足首までを下腿と呼ぶ,肩から肘までを前腕と呼ぶ,肘から手首までを上腕と呼ぶ,股から膝までを前腿と呼ぶ,正解：膝から足首までを下腿と呼ぶ\n肩から肘までは上腕です。肘から手首までは前腕です。またから膝までは大腿です。問題集20ｐにあります。,img/28.png,人体
1-29,人体の前面にある部位はどれか,鼠径部,肩甲部,腋窩部,臀部,正解：鼠径部\n他は背面にあります。問題集20ｐにあります,img/29.png,人体
1-30,人の細胞の内部構造について正しいものはどれか,人の細胞分裂は有糸分裂である,核の中には遺伝情報の本体であるRNAが含まれる,核の中には44個の染色体がある,ミトコンドリアは細胞に必要なたんぱく質を合成する,正解：人の細胞分裂は有糸分裂である\n核に含まれる遺伝物質はDNAです。染色体は23対46本です。ミトコンドリアはエネルギーの生成に関与します。問題集20ｐにあります,img/30.png,人体
1-31,細胞膜の機能と体液について正しいものはどれか,細胞膜は半透膜である,細胞内液と細胞外液の電解質組織は等しい,細胞内液と細胞外液の浸透圧は異なる,体液と等張の食塩水（生理食塩水）の濃度は9％である,正解：細胞膜は半透膜である\n細胞内液ではカリウムイオンが多く、細胞外液ではナトリウムイオンなどが多いです。細胞内液と細胞外液の浸透圧が異なると浮腫や脱水をおこします。生理食塩水の濃度は0.9％です。問題集21ｐにあります,img/31.png,人体
1-32,体液のイオン組成について血漿中に最も多いイオンはどれか,ナトリウムイオン,カリウムイオン,炭酸水素イオン,酸化物イオン,正解：ナトリウムイオン\n血漿に最も多く含まれるのはナトリウムイオンであり次いで塩化物イオン、カリウムイオン、炭酸水素イオンとなります。問題集21ｐにあります。,img/32.png,人体
1-33,アルカローシスになる病態について正しいものはどれか,嘔吐による胃液の大量喪失,ケトン体の異常増加,乳酸の異常増加,下痢による腸液の大量喪失,正解：嘔吐による胃液の大量喪失\n胃液は酸性の為、体の中にある量が減少するとアルカリ性に偏り、アルカローシスを引き起こします。ケトン体と乳酸はエネルギー生成に関与し生成されますが、中性であるため関係ありません。腸液はアルカリ性の為、失うと酸性に偏り、アシドーシスを引き起こします。問題集21ｐにあります。,img/33.png,人体
1-34,次の中で上皮組織があるものはどれか,気管支,骨格筋,大脳,心筋,正解：気管支\n上皮組織は空気と接触する場所にあります。消化管・気道・尿路・皮膚に存在します。問題集21ｐにあります。,img/34.png,人体
1-35,胃の構造について正しいものはどれか,入口に近い最上部を胃底と呼ぶ,胃の入り口を幽門と呼ぶ,胃の出口、十二指腸に移行する部分を噴門と呼ぶ,筋層は内斜・外縦の2層からなる,正解：入口に近い最上部を胃底と呼ぶ\n胃の入り口は噴門で出口は幽門です。筋層は輪状・外縦・内斜の三層構造です。問題集21ｐにあります。,img/35.png,人体
1-36,胃の構造と働きについて正しいものはどれか,主細胞はペプシノゲンを分泌する,胃液のPHは4～5である,壁細胞は粘液を分泌する,胃の入り口は幽門という,正解：主細胞はペプシノーゲンを分泌する\n胃のPHは1～1.5です。壁細胞は塩酸を分泌する。胃の入り口は噴門です。問題集22ｐにあります,img/36.png,人体
1-37,胃・十二指腸の働きについて正しいものはどれか,オッディ括約筋は胆汁や膵液の排出を調整する,十二指腸から分泌される消化管ホルモンはガストリンである,胃の内因子はビタミンDの吸収を助ける,胃の壁細胞からペプシノーゲンが分泌される,正解：オッディ括約筋は胆汁や膵液の排出を調整する\nガストリンは胃から分泌されます。胃の内因子はビタミンB12の吸収を助けます。壁細胞からは塩酸が分泌されます。問題集22ｐにあります。,img/37.png,人体
1-38,肛門の構造と機能について正しいものはどれか,肛門粘膜下には静脈叢が発達している,肛門上皮は単層円柱上皮である,外肛門括約筋は不随意筋である,排便中枢は延髄にある,正解：肛門粘膜下には静脈叢が発達している\n肛門上皮は重層扁平上皮です。外肛門括約筋は随意筋です。排便反射は仙髄にあります。問題集22ｐにあります,img/38.png,人体
1-39,栄養素と消化酵素の組み合わせで正しいものはどれか,糖質ー－－アミラーゼ,脂肪ーーートリプシン,タンパク質ーーーリパーゼ,炭水化物ーーーペプシン,正解：糖質ーーーアミラーゼ\n脂肪はリパーゼにて分解せれます。炭水化物も分解され糖質になるため根本的に同じものです。そのためアミラーゼにより分解されます。ペプシンなどそのほかの消化酵素はたんぱく質を分解する消化酵素です。問題集22ｐにあります。,img/39.png,人体
1-40,炭水化物を消化・吸収する部位はどれか,小腸,胃,十二指腸,大腸,正解：小腸\n問題集22ｐにあります。,img/40.png,人体
1-41,肝臓と胆汁について正しいものはどれか,肝臓は肝小葉とグリソン鞘からなる,肝臓は右葉・中葉・左葉からなる,胆汁は肝臓から分泌される,胆汁はファーター乳頭（大十二指腸乳頭）から胃内に排出される,正解：肝臓は肝小葉とグリソン哨からなる。\n肝臓は右葉・左葉・方形葉・尾状葉からなります。胆汁は肝臓で生成され、胆嚢で濃縮・貯蔵されます。ファーター乳頭は十二指腸にあります。問題集22ｐにあります。,img/41.png,人体
1-42,成人の肝臓の働きでないものはどれか,造血作用,糖代謝,解毒作用,凝固因子の生成,正解：造血作用\n胎児期の肝臓では造血を行いますが成人の造血は骨髄のみで行います。問題集23ｐにあります。,img/42.png,人体
1-43,胆汁が関与するものはどれか,脂質,糖質,タンパク質,電解質,正解：脂質\n胆汁に含まれる胆汁酸は、界面活性剤の構造を持ち、脂質をミセル化して吸収しやすくします。問題集23ｐにあります。,img/43.png,人体
1-44,胆汁について正しいものはどれか,大十二指腸乳頭から排出される,胆嚢で作られる,タンパク質の消化を助ける,大腸で再吸収される,正解：大十二指腸乳頭から排出される\n胆汁,img/44.png,人体
1-45,肺の構造について正しいものはどれか,肺の上端を肺尖と呼ぶ,肺の底部を呼ぶ,左肺は上葉・中葉・下葉の３葉に分けられる,右肺は上葉・下葉の２葉に分けられる,正解：肺の上端を肺尖と呼ぶ\n肺の底部は肺底です。右葉が３葉に分けられ、左葉が２葉に分けられます。問題集23ｐにあります。,img/45.png,人体
1-46,呼吸の生理について正しいものはどれか,チェーンストーク呼吸は呼吸中枢の興奮が低下したときに起こる,肺でのガス交換を内呼吸という,吸息時には、横隔膜は弛緩する,呼吸中枢は小脳にある,正解：チェーンストーク呼吸は呼吸中枢の興奮が低下したときに起こる\n肺でのガス交換は外呼吸です。吸息時横隔膜は収縮します。呼吸中枢は延髄になります。問題集24ｐにあります。,img/46.png,人体
1-47,呼吸の生理について正しいものはどれか,努力肺活量の最初の１秒間は呼出される量を１秒量という,成人の安静時１回換気量は約200mlである,肺胞内の酸素分圧は80mmHgである,酸素のほとんどが血液に溶けて運搬される,正解：努力肺活量の最初の１秒間は呼出される量を１秒量という\n成人の安静時一回換気量は約500ｍｌである。肺胞内の酸素分圧は100mmHgである。酸素のほとんどはHbにより運搬される。問題集24ｐにあります。,img/47.png,人体
1-48,生殖の生理について正しいものはどれか,排卵後の卵胞は黄体となる,卵胞が破れて卵子が飛び出すことを受精という,受精卵は卵管膨大部に着床する,黄体はプロラクチンを分泌する,正解：排卵後の卵胞は黄体となる\n卵胞が破れて卵子にちび出ることは排卵です。受精卵は子宮内膜に着床する。黄体はプロゲステロンを分泌します。問題集24ｐにあります。,img/48.png,人体
1-49,男性生殖系について正しいものはどれか,精子は射精管を通り尿道に出る,前立腺で精子が作られる,精子は24本の染色体をもつ,精嚢で精子が貯留される,正解：精子は射精管を通り尿道に出る\n精子は精巣で作られ、23本の染色体をもちます。精嚢では精子成分の一部を分泌します。問題集24ｐにあります。,img/49.png,人体
1-50,卵巣周期と月経周期について正しいものはどれか,卵胞の発育とともに子宮内膜は増殖する,月経周期は卵巣周期に一致しない,排卵とともに子宮内膜は剥離する,排卵後は基礎体温は低下する,正解：卵胞の発育とともに子宮内膜は増殖する\n月経周期と卵巣周期は一致します。排卵とともに子宮内膜は厚くなります。排卵後の基礎体温は上昇します。問題集24ｐにあります。,img/50.png,人体
1-51,腎臓の構造について正しいものはどれか,腎臓は後腹膜器官である,右腎のほうが左腎よりも高い位置にある,外側の膨らんだ部分を腎門と呼ぶ,腎盂は腎小体に富む,正解：腎臓は後腹膜器官である\n左腎のほうが右腎よりも高い位置にあります。外側の膨らんだ部分を外側縁と呼びます。腎盂に腎小体はない。問題集25ｐにあります。,img/51.png,人体
1-52,腎臓の仕組みと働きについて誤っているものはどれか,ネフロンは髄質ある,腎実質は皮質と髄質に分かれる,糸球体でろ過されて原尿が作られる,原尿は99％再吸収される,正解：腎実質は皮質と髄質に分けられる\nネフロンは皮質にあります。問題集25ｐにあります。,img/52.png,人体
1-53,腎臓から分泌されるのはどれか,レニン,アンギオテンシン,バソプレシン,アルドステロン,正解：レニン\n問題集25ｐにあります。,img/53.png,人体
1-54,尿の生成について正しいものはどれか,血液は糸球体でろ過される,アミノ酸は遠位尿細管で再吸収される,ネフロンは腎小体と尿細管からなる,成人の一日の糸球体ろ過量は約10Lである,正解：血液は糸球体でろ過される\nアミノ酸は近位尿細管で再吸収されます。ネフロンは腎小体と尿細管からなります。成人の一日のGFRは約150Lです。問題集25ｐにあります。,img/54.png,人体
1-55,尿の生成について正しいものはどれか,ネフロンは腎小体と尿細管からなる,血液は糸球体で濃縮される,原尿は尿細管でろ過されて尿となる,尿のほとんどは膀胱内で再吸収される,正解：ネフロンは腎小体と尿細管からなる\n血液は糸球体でろ過され原尿となります。原尿は尿細管で濃縮されて尿となります。尿の甫トンでは尿細管から再吸収されます。問題集25ｐにあります。,img/55.png,人体
1-56,腎機能について、正しいものはどれか,糸球体ろ過量（GFR）とは糸球体で単位時間にろ過される血漿の量である,糸球体ろ過量（GFR）は成人男子で約500ｍｌ/分である,ブドウ糖は遠位尿細管で100％再吸収される,集合管では、水の再吸収は行はない,正解：糸球体ろ過量（GFR）とは糸球体で単位時間にろ過される血漿の量である\n成人男子のＧＦＲは125ｍｌ/分です。ブドウ糖は近位尿細管で100％再吸収されます。集合管では水の再吸収は行います。問題集26ｐにあります。,img/56.png,人体
1-57,近位尿細管で再吸収されないのはどれか,クレアチニン,ナトリウム,グルコース,水,正解：クレアチニン\n他は再吸収されます。問題集26ｐにあります。,img/57.png,人体
1-58,副腎皮質ホルモンの働きについて正しいものはどれか,抗炎症作用がある,骨の成長を促進する,血糖値を下げる,カルシウムの再吸収を行う,正解：抗炎症作用がある\n骨の成長を促進するホルモンは成長ホルモンです。血糖値を下げるのはインスリンです。カルシウムの再吸収を行うのはパラソルモンです。問題集26ｐにあります。,img/58.png,人体
1-59,甲状腺について正しいものはどれか,甲状腺刺激ホルモンは下垂体前葉から分泌すされる,甲状腺はパラソルモン（PTH）を分泌する,甲状腺ホルモンは基礎代謝を低下させる,甲状腺機能亢進症はクレチン症という,正解：甲状腺刺激ホルモンは下垂体前葉から分泌される\nパラソルモンは副甲状腺から分泌されます。甲状腺ホルモンは基礎代謝を上昇させます。甲状腺機能亢進症はバセドウ病です。クレチン症は先天的甲状腺機能低下症です。後天的に甲状腺機能が低下するものを橋本病といいます。問題集26ｐにあります。,img/59.png,人体
1-60,甲状腺ホルモンの機能について正しいものはどれか,基礎代謝の亢進,体温の低下,骨の発育の抑制,タンパク質の合成・分解の抑制,正解：基礎代謝の亢進\n体温は上昇します。骨発育は成長ホルモンとパラソルモンです。タンパク質の合成分解は亢進します。問題集26ｐにあります。,img/60.png,人体
