id,question,choice1,choice2,choice3,choice4,explanation,img,category
7-207,臓器移植について正しいものはどれか,臓器提供ができる年齢に制限はない,レシピエントとは臓器提供者のことである,親族への優先提供の意思表示は認められていない,本人の臓器提供の意思が不明の場合臓器移植はできない,正解：臓器提供ができる年齢に制限はない\n臓器提供者はドナーといいます。親族への優先的提供の意思表示は認められています。本人の臓器提供の意思が不明の場合家族の承認により臓器提供ができます。問題集123pにあります。,img/708.png,基礎
7-208,事前指示書について誤っているものはどれか,法的に位置づけられている,リビングウェルと呼ばれる,意思決定能力がある間に文章で作成する,家族や医療従事者にとって意思決定の手がかりとなる,正解：法的に位置づけられている\n法的には位置づけられていません。問題集123pにあります。,img/709.png,基礎
7-209,事前指示書を意味するのはどれか,リビングウェル,アドボカシー,エンドオブライフケア,インフォームドコンセント,正解：リビングウェル\nアドボカシーは擁護を意味します。エンドオブライフケアは人が最期を迎えるまで自分らしい生活を送れるようにすることです。インフォームドコンセントは告知と同意です。問題集123pにあります。,img/710.png,基礎
7-210,インフォームドコンセントについて誤っているものはどれか,パターナリズムに基づいて行う,患者の自立性を尊重する,代替治療法について伝える,提案した治療を拒否した場合結果について伝える,正解：パターナリズムに基づいて行う\nパターナリズムとは本人の利益になるという理由で本人の意思に反して介入・干渉・支援する考え方です。問題集123pにあります。,img/711.png,基礎
7-211,インフォームドコンセントについて正しいものはどれか,説明と同意と訳される,医師以外は行わない,同じ行為に対して何度も行う必要はない,患者の自己決定権は尊重されない,正解：説明と同意と訳される\n看護師など医療従事者も行います。同じ行為に対してもそのたびに行います。患者の自己決定が最も尊重されます。問題集123pにあります。,img/712.png,基礎
7-212,インフォームドコンセントについて適切なものはどれか,知る権利に基づくものである,患者に拒否する権利はない,一回説明すればよい,看護行為の際は必要ない,正解：知る権利に基づくものである\n患者にも拒否権はあります。理解するまで説明を行います。看護行為の際にも必要です。問題集124pにあります。,img/713.png,基礎
7-213,看護師にとっての守秘義務について正しいものはどれか,情報開示には本人の同意が必要である,医療にかかわる情報に限定される,氏名は該当しない,保健師助産師看護師法には規定されていない,正解：情報開示には本人の同意が必要である\n医療にかかわる情報には限定されません。氏名も該当します。保健師助産師看護師法にも明記されています。問題集124pにあります。,img/714.png,基礎
7-214,看護師の倫理綱領の前文の部分で（）に当てはまる語句はどれか\n人々は人間としての尊厳を維持し健康で幸福であることを願っている\n看護はこのような人間の（　　　　　　　）にこたえ、人々の健康な生活の実現に貢献することを使命としている。,普遍的なニーズ,個別的なニーズ,潜在的なニーズ,顕在的なニーズ,正解：普遍的なニーズ\n問題集124pにあります。,img/715.png,基礎
7-215,准看護制度が制定されたのはどれか,1951年,1948年,1957年,1964年,正解：1951年\n問題集124pにあります。,img/716.png,基礎
7-216,准看護師制度が制定されたのはどれか,1951,1948,1957,1989,正解：1951\n問題集124pにあります。,img/717.png,基礎
7-217,アンリ・デュナンによって設立された人々の救命活動と公衆衛生活動に貢献することを目指す団体である,国際赤十字,国際看護協会,世界保健機関,世界医師会,正解：国際赤十字\n問題集125pにあります。,img/718.png,基礎
7-218,パーソナルコミュニケーションについて適切なものはどれか,個人対個人の間で行われる意見伝達行為である,多数の人に情報を送る一方通行のコミュニケーションである,伝達内容が抽象的なものの場合に有効である,言語的コミュニケーションを担う役割がある,正解：個人対個人の間で行われる意見伝達行為である\n多数の人に情報を送る一方通行のコミュニケーションはマスコミュニケーションです。パーソナルコミュニケーションは内容が具体的なものに対して有効です。非言語的コミュニケーションも重要です。問題集128pにあります。,img/719.png,基礎
7-219,言語的コミュニケーションはどれか,筆談,うめき,身振り,表情,正解：筆談\nうめき、身振り、表情は非言語的コミュニケーションです。問題集128pにあります。,img/720.png,基礎
7-220,開かれた質問はどれか,退院後は何をしたいですか,ゆうべは眠れましたか,食事は食べられましたか,尿と便の回数を教えてください,正解：退院後は何をしたいですか\n開かれた質問は質問に対して答えが決められていない質問を指します。問題集128pにあります。,img/721.png,基礎
7-221,開かれた質問はどれか,退院後はどのようにしたいですか,食事は全部食べれました,頭は痛いですか,夜は眠れますか,正解：退院後はどのようにしたいですか\n開かれた質問は質問に対して答えが決められていない質問を指します。問題集128pにあります。,img/722.png,基礎
7-222,看護におけるコミュニケーションで適切なものはどれか,傾聴は単に一方的に話を聞くことである,パーソナルコミュニケーションが基本となる,非言語的コミュニケーションでは視線・表情などが含まれる,開かれた質問は自由に回答できるタイプのものである,正解：非言語的コミュニケーションでは視線・表情などが含まれる\n傾聴とは相手の話を注意深く耳を傾け相手の気持ちや考えを理解しようと努めるスキルです。開かれた質問は自由に回答できるタイプの質問です。問題集129pにあります。,img/723.png,基礎
7-223,コミュニケーションについて適切なものはどれか,食欲はありますかは閉ざされた質問である,患者が黙り込んでも看護師は話し続ける,看護師は患者の真正面に座って話を聞く,非言語的コミュニケーションは音声を伴わない,正解：食欲はありますかは閉ざされた質問である\n時には無言になり会話を引き出すことも大切です。看護師は患者の斜め45度から話すと有効です。うめき声などは非言語的コミュニケーションに分類されます。問題集129pにあります。,img/724.png,基礎
7-224,コミュニケーションについて適切なものはどれか,表情は非言語的コミュニケーションに含まれる,専門用語は積極的に使用して会話をする,頭は痛いですかは開かれた質問である,会話をするときはテレビやラジオの音は気にしなくてもよい,正解：表情は非言語的コミュニケーションに含まれる\n専門用語は患者のわかる言葉にして伝えます。頭は痛いですかははい/いいえで答えられるため閉ざされた質問です。環境音は会話の支障となるため少なくします。問題集129pにあります。,img/725.png,基礎
7-225,情動焦点型コーピングはどれか,出来事の見方を変えてみたり楽観的に考える,その問題を解決するための計画を立て実行する,原因を考えて別の方法で取り組んでみる,よい解決の方法を他人に聞く,正解：出来事の見方を変えてみたり楽観的に考える\n問題解決型は計画を立てたり他人に聞くことです。原因を考えて別の方法で取り組むのはストレス解消法です。問題集129pにあります。,img/726.png,基礎
7-226,問題焦点型コーピングはどれか,問題の解決方法を調べる,楽観的に考える,誰かに愚痴を聞いてもらう,別のことをして気持ちを紛らわせる,正解：問題の解決方法を調べる\n他の選択肢はストレス解消法です。問題集129pにあります。,img/727.png,基礎
7-227,ストレスを作り出す刺激をなんというか,ストレッサー,コーピング,ストレス耐性,耐性,正解：ストレッサー\nコーピングはストレスの対処方法です。ストレス反応は身体反応として症状にあらわれます。耐性は受けにくいことです。問題集129pにあります。,img/728.png,基礎
7-228,ライフサイクルと心理の特徴・心理的危機の組み合わせで正しいものはどれか,幼児期ーーー分離不安,青年期ーーーからの巣症候群,成人期ーーーせん妄,老年期ーーー燃え尽き症候群,正解：幼児期ーーー分離不安\n青年期に多く見られるものはせん妄です。成人期では燃え尽き症候群、老年期にはからの巣症候群がよく見られます。問題集130pにあります。,img/729.png,基礎
7-229,医療安全について適切なものはどれか,ヒヤリハットとはヒヤリとしたことやハッとした体験をとらえて表現する,ヒューマンエラーゼロを目指す,アクシデントとヒヤリハットは同義語として使用される,インシデントとは未然に防げなかった医療事故をいう,正解：ヒヤリハットとはヒヤリとしたことやハッとした体験をとらえて表現する\nアクシデントは医療事故です。インシデント・ヒヤリハットは医療事故に至らなかった事象を指します。ヒューマンエラーはゼロにはできません。問題集130pにあります。,img/730.png,基礎
7-230,医療事故の防止について適切なものはどれか,看護師個人だけでなく組織で対策を考える,医療機器の点検は不要である,看護師の思い込みは重大な事故にはつながらない,自分は医療事故を起こさないという確信を持つ,正解：看護師個人だけでなく組織で対策を考える\n医療機器の点検は必要です。看護師の思い込みは事故につながることもあります。自分も事故を起こすかもしれないという意識を持つことが大切です。問題集130pにあります。,img/731.png,基礎
7-231,抑制法について適切なものはどれか,患者や家族の同意が必要である,抑制を実施するか否かの判断は看護師が行う,抑制を実施する理由についての記録は必要ない,人権擁護の観点から問題はない,正解：患者や家族の同意が必要である\n抑制は人権擁護の観点から問題があります。実施するにあたって記録が必要です。抑制の判断は医師が行います。問題集130pにあります。,img/732.png,基礎
7-232,標準予防策について誤っているものはどれか,感染症の有無で適応を診断する,ゴーグルを使用する,汗を除くすべての湿性生体物質は感染症の病原体を含む可能性があるとみなす,交差感染を防ぐ目的もある,正解：感染症の有無で適応を判断する\n標準予防策は感染症の有無にかかわらずすべての患者に行います。問題集130pにあります。,img/733.png,基礎
7-233,感染予防策について適切なものはどれか,手指衛生（手洗い）が最も重要である,すべての人の血液・汗を感染の可能性があるものとして扱う,患者に使用したリネン・衛生材料はすべて燃焼する,手袋・マスクを着用すれば個人防護具としては十分である,正解：手指衛生（手洗い）が最も重要である\nスタンダードプリコーションに汗は含みません。患者に使用したものはすべて消毒します。個人防護具は手袋・マスク・ガウン・ゴーグルです。問題集131pにあります。,img/734.png,基礎
7-234,標準予防策において感染源とみなすものはどれか,尿,傷のない皮膚,爪,汗,正解：尿\n標準予防策では感染源を汗以外のすべての体液・分泌物としています。問題集131pにあります。,img/735.png,基礎
7-235,個人防護具について正しいものはどれか,マスクはガウン装着後に装着する,最初にガウンの襟紐を結び頭を通す,手袋の袖口はガウンの袖口上に重ねないように装着する,ガウンを脱ぐときは汚染部を外側にして廃棄する,正解：マスクはガウン装着後に装着する\n袖を通してから首・腰のひもを結びます。手袋はガウンの袖口に重ねます。廃棄は汚染部を内側にして行います。問題集131pにあります。,img/736.png,基礎
7-236,個人防護具の脱着の順序で最初に脱ぐのはどれか,手袋,マスク,ゴーグル,ガウン,正解：手袋\n手袋、ゴーグル、マスク、ガウンの順に脱ぎます。問題集131pにあります。,img/737.png,基礎
7-237,手指衛生について誤っているものはどれか,流水と石けんにより10秒間の手洗いは速乾性擦式消毒液と同等の消毒効果がある,1行為1手洗いが原則である,指先と爪は洗い残ししやすい部分である,速乾性擦式消毒薬は乾燥するまですりこむ,正解：流水と石けんにより10秒間の手洗いは速乾性擦式消毒液と同等の消毒効果がある\n流水と石けんにより速乾性擦式消毒薬と同等の殺菌効果を出すには40～60秒が必要です。問題集131pにあります。,img/738.png,基礎
7-238,手指衛生の方法について正しいものはどれか,看護行為の前後には必ず手洗いを行う,石けんと流水による洗浄法では10秒かけて行う,洗い残しが多いのは手掌部である,CDCガイドラインでは石けんによる手洗いが推奨されている,正解：看護行為の前後には必ず手洗いを行う\n石けんと流水による場合は40～60秒かけて行います。洗い残しが多いのは指先や指の間です。CDCガイドラインでは石けんによる手洗いに加えアルコールによる手指消毒が推奨されています。問題集132pにあります。,img/739.png,基礎
7-239,石けんについて適切なものはどれか,指を交差させて指間を洗う,石けんと流水による場合は10～20秒かけて行う,指輪は装着したまま洗う,手掌側の小指は洗い残しが多い,正解：指を交差させて指間を洗う\n流水と石けんによる手洗いは40～60秒かけて行います。指輪や装飾品は外して手洗いします。洗い残しは指先や指の間が多いです。問題集132pにあります。,img/740.png,基礎
7-240,無菌操作について正しいものはどれか,鑷子立てから出し入れする際は鑷子の先端を閉じておく,無菌操作の作業環境は腰よりも低い場所が適切である,綿球の受け渡しは介助者の鑷子を処置者の鑷子より下にする,処置前の滅菌手袋に触れてよい部分は手袋の外側である,正解：鑷子立てから出し入れする際は鑷子の先端を閉じておく\n無菌操作は腰よりも高い場所が適切です。綿球は介助者の鑷子が上になるように渡します。問題集132pにあります。,img/741.png,基礎
7-241,鑷子を用いた無菌操作について誤っているものはどれか,不潔な鑷子が清潔な鑷子より高い位置にあるようにする,滅菌物は腰から上の視野に入る範囲で扱う,鑷子を取り出すときは鑷子の先端を閉じる,常に先端が水平より下を向くように持つ,正解：不潔な鑷子が清潔な鑷子より高い位置にあるようにする\n不潔な鑷子は清潔な鑷子より低い位置にあるようにします。問題集132pにあります。,img/742.png,基礎
7-242,感染と予防について誤っているものはどれか,目に見える汚染があるときは速乾性擦式消毒薬を用いた手指消毒を行う,感染は感染源・感染経路・感受性の3つの要因がそろった場合起こる,感染予防には標準予防策と感染経路別予防策がある,看護師は院内感染の感染源となりうる,正解：目に見える汚染があるときは速乾性擦式消毒薬を用いた手指消毒を行う\n目に見える汚染があるときは石けんによる手洗いを行います。速乾性擦式消毒薬は目に見えない汚染に有効です。問題集132pにあります。,img/743.png,基礎
7-243,感染予防について適切なものはどれか,空気感染の感染経路を遮断するにはN95マスクを装着する,標準予防策は血液・分泌物・汗・排泄物を感染源として扱う,個人防護具はマスク・手袋・ゴーグル・ガウンの順に外す,速乾性擦式手指消毒は肉眼的に手指が汚れている場合に用いる,正解：空気感染の感染経路を遮断するにはN95マスクを着用する\n標準予防策は汗以外のすべての体液を感染源とみなします。個人防護具の外す順序は手袋、ゴーグル、ガウン、マスクです。アルコール消毒は肉眼的に手が汚れていない場合に用います。問題集133pにあります。,img/744.png,基礎
7-244,感染予防策について適切なものはどれか,速乾性すり込み式手指消毒法は消毒液が乾燥するまで十分すり込む,標準予防策は必要な患者に講じる予防対策である,飛沫感染の予防策としてN95マスクを着用する,使用済みのリネンは振り払って埃などを取り除く,正解：速乾性すり込み式手指消毒法は消毒液が乾燥するまで十分すり込む\n標準予防策はすべての患者に講じる予防策です。飛沫感染の予防策は不織布マスクで十分です。N95マスクは空気感染の予防策です。使用済みのリネンは埃ごとまとめて洗います。問題集133pにあります。,img/745.png,基礎
7-245,感染源隔離について正しいものはどれか,行動や面会の制限がある,感染しやすい状態の患者が対象である,無菌室を使用する,使用した部屋の消毒は必要ない,正解：行動や面会の制限がある\n感染している患者が対象であり、必ずしも無菌室でなくてもよいです。使用した部屋は念入りな消毒が必要です。問題集133pにあります。,img/746.png,基礎
7-246,血液が付着したガーゼを破棄する容器のバイオハザードマークは何色か,橙色,赤色,黄色,緑色,正解：橙色\n赤色は血液そのものです。黄色は鋭利なものです。緑色はありません。問題集133pにあります。,img/747.png,基礎
7-247,橙色のバイオハザードマークが表示された容器に入れるものはどれか,血液が付着したガーゼ,血液,使用済みのアンプル,注射針,正解：血液が付着したガーゼ\n血液や体液は赤色のバイオハザードマークがつきます。使用済みのアンプルや注射針は黄色のバイオハザードマークがつきます。問題集133pにあります。,img/748.png,基礎
7-248,体位について適切なものはどれか,端座位はベッドの端に座り下肢を床に下す,起座位は上半身を約45度に起こす,シムス位は両膝を伸展させる,立位は支持基底面が広いのが特徴である,正解：端座位はベッドの端に座り下肢を床に下す\n上半身を45度に起こすのはファーラー位（半座位）です。両膝を伸展させて座るのは長座位です。立位は支持基底面が狭いことが特徴です。問題集134pにあります。,img/749.png,基礎
7-249,体位について正しいものはどれか,立位は座位よりエネルギー消費が大きい,仰臥位は腸骨や外果部に褥瘡ができやすい,腹臥位は呼吸困難時に適している,長座位は腹部や臀部への負荷が少ない,正解：立位は座位よりエネルギー消費量が大きい\n腸骨や外果部の褥瘡が好発する体位は側臥位です。呼吸困難時に適した体位はファーラー位や起座位です。長座位は腰部や臀部に負荷が大きいです。問題集134pにあります。,img/750.png,基礎
7-250,良肢位について正しいものはどれか,患者の移動を行う場合には手この原理を活用する,膝を立てないほうが小さな力で体位変更ができる,患者を水平移動するときはなるべく体を患者から離して行う,患者を支えるときは看護師の足の幅が狭いほうが安定する,正解：患者の移動を行う場合にはてこの原理を活用する\n膝を立てたほうがトルクの原理により小さな力で体位変更ができます。水平移動は患者になるべく近づいて行います。患者を支えるときは看護師の足の幅が広いほうが安定します。問題集134pにあります。,img/751.png,基礎
7-252,ボディメカニクスの原則で適切なものはどれか,患者の体を動かすときは摩擦を小さくする,重心の位置は高いほうが安定する,支持基底面の面積は狭いほうが安定性が良い,患者の水平移動には自分の重心を患者の重心から遠ざけるとよい,正解：患者の身体を動かすときは摩擦を小さくする\n重心は低いほうが安定します。支持基底面の面積は広いほうが安定します。患者の水平移動時は自分と患者の重心を近づけます。問題集134pにあります。,img/752.png,基礎
7-253,ボディメカニクスの原則について適切なものはどれか,トルクの原理を用いる,支持基底面を狭くする,重心は支持基底面の外に置く,重心の位置を高くする,正解：トルクの原理を用いる\n支持基底面は広くします。重心は支持基底面の内側に置きます。重心の位置は低くします。問題集135pにあります。,img/753.png,基礎
7-254,ジャパンコーマスケールで意識レベルⅡ-20と判定される状態はどれか,大きな声で呼びかけるまたは体を揺さぶることにより開眼する,時・人・場所がわからない,痛み刺激に対し払いのけるような動作をする,痛み刺激に対し手を動かしたり顔をしかめる,正解：大きな声で呼びかけるかまたは体を揺さぶることにより開眼する\n失見当識は1-3以上です。痛みを払いのけるような動作をするのは3-100です。痛み刺激に対して手足を動かす、顔をしかめるのは3-200です。問題集135pにあります。,img/754.png,基礎
7-255,ジャパンコーマスケールで意識レベル3-200と判定される状態はどれか,痛み刺激に対して払いのけるような動作をする,自分の名前や生年月日が言えない,大声で呼ぶか身体を揺さぶれば開眼する,痛み刺激に全く反応しない,正解：痛み刺激に対して払いのける動作をする\n自分の名前や生年月日を言えないのは1-3です。大声で呼ぶか体を揺さぶれば開眼するのは2-20です。痛み刺激に全く反応しないのは3-300です。問題集135pにあります。,img/755.png,基礎
7-256,グラスゴーコーマスケールについて正しいものはどれか,全く開眼しない状態は1点である,発語しない状態は2点である,痛み刺激で手足を伸展する状態は5点である,命令に伴う状態は4点である,正解：全く開眼しない状態は1点である\n発語しない状態は1点です。痛み刺激で手足を伸展する状態は2点です。命令に従う状態は6点です。問題集135pにあります。,img/756.png,基礎
7-257,体温の生理的変動について正しいものはどれか,一日のうちでは午前4～6時ころの間が最も低い,老年期の体温は成人期に比べて高い,体温は食事では変動しない,激しい精神的な興奮は体温を低下させる,正解：一日のうちでは午前4～6時ころの間が最も低い\n老年期の体温は成人期に比べて低いです。食事により体温は高くなります。激しい興奮では体温が高くなります。問題集136pにあります。,img/757.png,基礎
